{
  "schema_version": "0.1",
  "id": "worker-handoff-context-limit-001",
  "semantic_area": "worker_handoff",
  "contract": {
    "id": "loom.capability-handoff",
    "version": "0.1"
  },
  "operation": "worker_handoff",
  "input": {
    "execution_id": "exec-3",
    "handoff_id": "handoff-3",
    "required_context_bytes": 8192,
    "context_limit_bytes": 1024,
    "required_context": {
      "prior_result": {
        "outcome": "succeeded"
      },
      "evidence": [
        {
          "evidence_id": "ev-1"
        }
      ]
    }
  },
  "expected": {
    "outcome": "context_limit_exceeded",
    "handoff_executed": false,
    "silent_truncation": false,
    "required_context_dropped": false
  }
}
