{
  "schema_version": "0.1",
  "id": "worker-handoff-unauthorized-context-001",
  "semantic_area": "worker_handoff",
  "contract": {
    "id": "loom.capability-handoff",
    "version": "0.1"
  },
  "operation": "worker_handoff",
  "input": {
    "execution_id": "exec-2",
    "handoff_id": "handoff-2",
    "source_implementation": "worker-a",
    "destination_implementation": "worker-b",
    "requested_context": {
      "input": true,
      "evidence": true,
      "credential": true,
      "private_reasoning": true
    },
    "authorization": {
      "input": true,
      "evidence": true,
      "credential": false,
      "private_reasoning": false
    }
  },
  "expected": {
    "outcome": "authorization_denied",
    "handoff_executed": false,
    "credential_transferred": false,
    "private_reasoning_transferred": false
  }
}
